{
  "$schema": "https://json-schema.org/draft/2020-12/schema",
  "$id": "evidence-object.schema.json",
  "title": "Evidence Object",
  "description": "Reference-only evidence object. Evidence class records how a statement was produced. It does not establish truth, authenticity, or authority.",
  "type": "object",
  "additionalProperties": false,
  "properties": {
    "schema_version": {
      "type": "string",
      "const": "1.0.0",
      "minLength": 1
    },
    "evidence_id": {
      "type": "string",
      "minLength": 1
    },
    "subject_id": {
      "type": "string",
      "minLength": 1
    },
    "configuration_digest": {
      "type": "string",
      "pattern": "^sha256:[a-f0-9]{64}$"
    },
    "evidence_class": {
      "type": "string",
      "enum": [
        "OBSERVED",
        "MEASURED",
        "EXTERNAL_SOURCE",
        "HUMAN_INFERENCE",
        "MODEL_INFERENCE",
        "SIMULATION",
        "TEST_RESULT"
      ],
      "minLength": 1
    },
    "source_ref": {
      "type": "string",
      "minLength": 1
    },
    "provenance": {
      "type": "object",
      "additionalProperties": false,
      "required": [
        "source",
        "method",
        "recorded_at"
      ],
      "properties": {
        "source": {
          "type": "string",
          "minLength": 1
        },
        "method": {
          "type": "string",
          "minLength": 1
        },
        "recorded_at": {
          "type": "string",
          "pattern": "^\\d{4}-\\d{2}-\\d{2}T\\d{2}:\\d{2}:\\d{2}Z$"
        }
      }
    },
    "observed_or_generated_at": {
      "type": "string",
      "pattern": "^\\d{4}-\\d{2}-\\d{2}T\\d{2}:\\d{2}:\\d{2}Z$"
    },
    "validity": {
      "type": "object",
      "additionalProperties": false,
      "required": [
        "state",
        "valid_until"
      ],
      "properties": {
        "state": {
          "type": "string",
          "enum": [
            "CURRENT",
            "EXPIRED",
            "UNKNOWN"
          ],
          "minLength": 1
        },
        "valid_until": {
          "type": "string",
          "pattern": "^\\d{4}-\\d{2}-\\d{2}T\\d{2}:\\d{2}:\\d{2}Z$"
        }
      }
    },
    "artifact_digest": {
      "type": "string",
      "pattern": "^sha256:[a-f0-9]{64}$"
    },
    "limitations": {
      "type": "array",
      "minItems": 1,
      "items": {
        "type": "string",
        "minLength": 1
      }
    },
    "uncertainty": {
      "type": "string",
      "minLength": 1
    },
    "supersedes": {
      "type": "string"
    },
    "reference_only": {
      "type": "boolean",
      "const": true
    },
    "authority_effect": {
      "type": "string",
      "const": "NONE",
      "minLength": 1
    }
  },
  "required": [
    "schema_version",
    "evidence_id",
    "subject_id",
    "configuration_digest",
    "evidence_class",
    "source_ref",
    "provenance",
    "observed_or_generated_at",
    "validity",
    "artifact_digest",
    "limitations",
    "uncertainty",
    "supersedes",
    "reference_only",
    "authority_effect"
  ]
}
